{
  "id": "tivimate",
  "name": "TiviMate Orange",
  "layout_id": "tivimate",
  "tokens": {
    "--bg": "#0e1217",
    "--surface": "#0a0d12",
    "--surface-raised": "#13171f",
    "--text": "#e6e9ef",
    "--muted": "#8b95a5",
    "--accent": "#ff7d3a",
    "--border": "#1b1f27",
    "--font-scale": "1"
  }
}
