{
  "id": "apple-tv",
  "name": "Apple TV Dark",
  "layout_id": "apple-tv",
  "tokens": {
    "--bg": "#1c1c1e",
    "--surface": "#2c2c2e",
    "--surface-raised": "#3a3a3c",
    "--text": "#f5f5f7",
    "--muted": "#98989d",
    "--accent": "#0071e3",
    "--border": "#38383a",
    "--font-scale": "1"
  }
}
